{
  "name": "mug-atlas-merge-check",
  "source": ".dev-shots/asset-pipeline/mug-001/mug_source_003.blend",
  "objects": ["Mug_Root"],
  "out_dir": ".dev-shots/asset-pipeline/mug-001/atlas-review-003",
  "resolution": 256,
  "margin": 4,
  "samples": 4,
  "alpha": false,
  "export": false,
  "blend": "mug_atlas_review_003.blend"
}
