{
  "source": ".dev-shots/asset-pipeline/phase7/benchmark/retro-laptop-detail-001/atlas-review-004/retro_laptop_atlas_review_004.blend",
  "objects": ["Atlas_Shell_Root"],
  "out_dir": ".dev-shots/asset-pipeline/phase7/benchmark/retro-laptop-detail-001/atlas-review-004/review",
  "views": "top,three_quarter",
  "preset": "material",
  "isolate": true,
  "frame": 1,
  "resolution": [900, 800]
}
