{
  "source": ".dev-shots/asset-pipeline/phase7/benchmark/retro-laptop-detail-001/hybrid-review-006/retro_laptop_hybrid_review_006.blend",
  "objects": ["RetroLaptop_Root"],
  "out_dir": ".dev-shots/asset-pipeline/phase7/benchmark/retro-laptop-detail-001/hybrid-review-006/delivery-review-open",
  "views": "three_quarter",
  "preset": "material",
  "pose_object": "Atlas_Shell_Hinge",
  "frame": 20,
  "resolution": [900, 800]
}
