{
  "source": ".dev-shots/asset-pipeline/phase7/benchmark/retro-laptop-detail-001/atlas-review-005/retro_laptop_atlas_review_005.blend",
  "objects": ["Atlas_Shell_Root"],
  "out_dir": ".dev-shots/asset-pipeline/phase7/benchmark/retro-laptop-detail-001/atlas-review-005/open-review",
  "views": "top,three_quarter",
  "preset": "material",
  "pose_object": "Atlas_Shell_Hinge",
  "frame": 20,
  "resolution": [900, 800]
}
