{
  "source": ".dev-shots/asset-pipeline/phase7/benchmark/retro-laptop-detail-001/hybrid-review-005/retro_laptop_hybrid_review_005.blend",
  "objects": ["RetroLaptop_Root"],
  "out_dir": ".dev-shots/asset-pipeline/phase7/benchmark/retro-laptop-detail-001/hybrid-review-005/gate-review",
  "views": "front,side,top,three_quarter",
  "preset": "material",
  "frame": 1,
  "resolution": [900, 800]
}
