{
  "name": "retro-laptop-atlas",
  "objects": ["Shell_Root"],
  "exclude": ["Shell_Review_Ground", "Keyboard_Well_Cutter"],
  "out_dir": ".dev-shots/asset-pipeline/phase7/benchmark/retro-laptop-detail-001/atlas-001",
  "resolution": 2048,
  "margin": 8,
  "samples": 8,
  "alpha": true,
  "unwrap_margin": 0.02,
  "export": "retro_laptop_atlas_001.glb",
  "blend": "retro_laptop_atlas_source_001.blend"
}
