{
  "name": "retro-laptop-atlas-material-check",
  "source": ".dev-shots/asset-pipeline/phase7/benchmark/retro-laptop-detail-001/retro_laptop_detail_source_050.blend",
  "objects": ["Shell_Root"],
  "exclude": ["Shell_Review_Ground", "Keyboard_Well_Cutter"],
  "out_dir": ".dev-shots/asset-pipeline/phase7/benchmark/retro-laptop-detail-001/atlas-review-006",
  "resolution": 2048,
  "margin": 8,
  "samples": 4,
  "alpha": true,
  "export": false,
  "blend": "retro_laptop_atlas_review_006.blend"
}
