{
  "name": "retro-laptop-atlas-4096-review",
  "source": ".dev-shots/asset-pipeline/phase7/benchmark/retro-laptop-detail-001/retro_laptop_detail_source_050.blend",
  "objects": ["Shell_Root"],
  "out_dir": ".dev-shots/asset-pipeline/phase7/benchmark/retro-laptop-detail-001/atlas-review-005",
  "resolution": 4096,
  "margin": 12,
  "samples": 8,
  "alpha": true,
  "export": false,
  "blend": "retro_laptop_atlas_review_005.blend"
}
