{
  "name": "mug-atlas-review",
  "source": ".dev-shots/asset-pipeline/mug-001/mug_source_003.blend",
  "objects": ["Mug_Root"],
  "out_dir": ".dev-shots/asset-pipeline/mug-001/atlas-review-001",
  "resolution": 1024,
  "margin": 8,
  "samples": 16,
  "alpha": true,
  "export": false,
  "blend": "mug_atlas_review_001.blend"
}
